Категория;Анекдот
Вовочка;"Учительница на уроке загадывает детям загадки. (Самые обыкновенные, и нет смысла их мне пересказывать) Никто не может их правильно отгадать, и каждый раз на неправильный ответ учительница говорит: ""Вообще то это - (говорит пра- вильный ответ), но ход мысли у тебя правильный"". Вовочке надоело это слушать, он поднимает руку и говорит: ""Марья Ивановна, а теперь Вы отгадайте загадку"". ""Между ног болтается, на ""х"" начинается"". Учительница покраснев: ""Вовочка! Встань и выйди из класса"". Вовочка выходя из класса: ""Вообще то это хобот, но ход мысли у Вас правильный"" Еще вариант - ""Пока стоит - качается, когда кончает - кланеется. Из трех букв на ""х"" начинается"" - Хор."
Вовочка;"У: Дети, приведите примеры предложений с оборотом ""видимо...потому что"" Таня: Видимо будет дождь, потому что ласточки летают низко. У: Молодец, Таня. Вовочка: Бабушка взяла газету. У: Ну и что? В: Видимо захотела ср@ть, потому что читать она не умеет."
Вовочка;"Вовочка послал учительнице записку: ""Я Вас люблю"". Учительница в ответ: ""Терпеть не могу детей"". Тогда Вовочка посылает вторую записку: ""Гарантирую -- детей не будет!"""
Вовочка;Приходит Вовочка в первый класс. - А ты считать умеешь? - интересуется учительница. В: - Один, два, три, четыре, пять, шесть, семь... Училка: - А дальше знаешь? В: - ... восемь, девять, десять, валет, дама, король, туз...
Вовочка;Леночка ! Как летают утки ?! - Утки ? Утки летают косяками ! - Косяками ? Косяками - это пять ! Васенька ! Как ездят машины ?! - Машины ? Машины ездят на колесах ! - На колесах ? На колесах - это пять ! Вовочка ! Как пасутся коровы ? - Коровы ? Коровы пасутся на травке ! - На травке ? На травке - это пять ! Как твоя фамилия ? - Косячков ! - Косячков ? Косячков - это пять ! Пять, Косячков ! Пять косячков (пых,пых) - это зачет !
Вовочка;"На уроке биологии Марйя Ивановна спрашивает - Дети, у кого самые большие яица ? Миша - У курочки - Молодец !!! Аня- У пингвина ... - Ну может ... Вовочка тянет руку - Ну а ты как думаешь Вовочка ??? Вовочка- Самые большие яица у слона !!! - ;-Е Садись Вовочка - Два !!!! Вовочка- Да, Да Марья Ивановна, 2 таких больших ..."
Вовочка;Детский садик. Воспитательница загадывает детям загадку: - Два конца, два кольца, посередине гвоздик. Дети, кто знает, что это? Вовочка тянет руку: - Я знаю. Свадьба гомосексуалистов! - Вовочка... Как тебе не стыдно!!! И гвоздик откуда? - А это их пригвоздила социалистическая мораль!
Вовочка;Купил папа Вовочки мини-завод по производству колбасы, и учит его с ним обращаться: - Сюда засовываем барана, и получаем девять палок колбасы. Две отдаем государству, а семь оставляем себе. До тебя дошло ? Вовочка ? - Непонял. :-& - Сюда ложим барана, и отсюда вылазит девять палок колбасы. Две отдаем государству, а семь оставляем себе. Ты понял ?!?!? - Нет, А бывает такая машина только наоборот? - Да! Вовочка это твоя мама! :)
Вовочка;Учитильница жалуется Вовочкиному отцу: - Вы знаете, ваш сын ругается, дерется, ко всем пристает! - Ну Вовка! Я его убью на х#$й! Через неделю учительница звонит: - Вы знаете, Вовочка совсем разболтался - он вообще не появляется в школе! - А это я его убил на х#$й!
Вовочка;Приходит к Вовочке домой училка и жалуется отцу: - Ваш сын нарисовал на парте муху, так я убить пыталась- руку отбила :-( . Отец: - Енто ерунда он тут давеча крокодила в ванной нарисовал, так я через нарисованную дверь выскочил.
Вовочка;Разговаривает Вовочка (В) c Танечкой (Т) в школе: В: Что Танечка грустная такая? Т: Да вот, папа вчера из командировки приехал - суточные не привез :( В: Это что, у меня мама с отдыха вчера приехала - месячные не привезла...
Вовочка;В школе учительница знакомится с учениками,спрашивает как зовут,кто родители,etc. Встает Машенька,говорит: -Маша Иванова,папа русский,мама русская,я тоже русская. Встает Мойша и говорит: -А у меня папа еврей,мама еврейка,родился я в России,поэтому русский. Тут встает Вовочка(не шурин) и говорит : -Эт чож такое получается,у меня вот папа русский,мама русская,родился я в гараже,так я что, ЗиЛ-130 чтоли!!!!!
Вовочка;"Идет урок математики. Учительница спрашивает домашние задания. Ну что, Маша, кем работает твой папа? - Мой папа - милиционер. Сколько получает? - 100 тысяч рублей. А мама? - Мама у меня - инженер. Получает 50 тысяч рублей. Ну и сколько у вас бюджет семьи? - 150 тысяч . Молодец 5. Дошла очередь и до Вовочки. Ну папа у меня директор коммерческого магазина. Получает 7 миллионов. Мама у меня главный бухгалтер банка. Получает 5 миллионов. Бюджет семьи у нас 50 миллионов. - Садись Вовочка, Два! ""Да черт с ней, с двойкой. Зато как люди живем!!!!"""
Вовочка;"Маленькому Вовочке говорят: ""Вовочка, если ты не перестанешь матом ругаться, у тебя зубки не вырастут."", на что Вовочка, тыкая пальцем в молочный зуб отвечает: ""А это сто, х$#, столи?"""
Вовочка;Вовочка приходит к маме и говорит : - Мама, я хочу женится на Боре из соседнего подъезда Мама : - На Боре нельзя ! - Но мама, я люблю его - На Боре нельзя, ты опозоришь нас с папой по гроб жизни !! - Но мама, почему ? - Но ведь Боря еврей !!!
Вовочка;На уроке. Учительница: - Дети, вот я держу в руках кирпич. Что вы думаете, глядя на него? Леночка: - Я думаю о великом подвиге советских строителей! Женечка: - А я думаю о перспективах коммунистического строительства в нашей стране. Вовочка, - А я - о бабах. Учительница: - Вовочка, но почему? Вовочка: - А я о них всегда думаю.
Вовочка;"Учительница просит детей придумать предложение со словом АНАНАС. Маша: "" Ананасы растут в африке."" Учительница: "" Молодец Маша."" Миша: "" Папа купил в магазине ананас."" Учительница: "" Молодец."" Вовочка: "" А от нас папа ушел."" Учительница: "" ?!? А где же слово ананас?"" Вовочка: ""А_на_нас с мамой #@$ положил."""
Вовочка;Дети пришли на экскурсию в зоопарк. Стоят, разглядывают зверюшек. Вдруг какой-то козлик запрыгнул на козочку и начал ее иметь. Детишки увидали это, к учительнице подходит Машенька и спрашивает: - Марья Петровна, а зачем это козлик на козочку запрыгнул ? - А это он для того запрыгнул, чтобы лучше видеть травку, небо, птичек. Вовочка: - Марья Петровна ! А можно мне в-о-о-н ту птичку получше разлядеть ?
Вовочка;Вовочка потходит к папе и спрашивает: -Папа,а правда что на зиму все аисты улетают в тюплые страны? -Да сынок.А что? -А как же тагда я родился в январе?
Вовочка;Вовочка подбежал к огромному псу и стал гладить его пышный хвост. Мать в испуге кричит: - Что ты делаешь? Он же укусит тебя! - Нет, мама, с этого конца они не кусаются.
Вовочка;Мама кричит с балкона: - Вовочка, где ты? Нет ответа. Она зовет снова и снова, наконец из кустов раздается недовольный голос: - Ну, что? - Чем ты там занимаешься? - Машку трахаю! - Смотри, только не кури!
Вовочка;Вся семья сидит за столом. Обедают. Мать говорит сыну: - Вовочка, отдай кость папе, ты же не собака.
Вовочка;Учитель спрашивает учеников: - Какая личность, с которой вы столкнулись в течение учебного года, потрясла вас сильнее всего? - Меня - Наполеон. - Меня - Ганнибал. - Меня - Юлий Цезарь. - А меня, - сказал Вовочка, - мой отец, когда он увидел табель за первое полугодие.
Вовочка;- Вовочка, канарейка куда-то исчезла! - Странно, пять минут назад я ее пылесосил, и она была на месте.
Вовочка;Пятилетний Вова встречает маму у дверей и радостно сообщает: - Мамочка, а я твой новый парик на котеночка выменял.
Вовочка;Учительница спрашивает на уроке биологии: - Дети, какого цвета бывают яйца? - Серые, белые. Вовочка: - Синие. - Вовочка, у кого ты их видел? - У сторожа, когда он их дверью прищемил.
Вовочка;Когда Вовочку спросили, может ли он назвать пять самых счастливых лет в своей жизни, он ответил: - Конечно, это когда я учился в первом классе.
Вовочка;Вовочка сидит в песочнице и лепит кулички. Мимо проходит мужик и наступает на один. - Мужик, ты что ох...ел? Мужик повел Вовочку к маме и говорит: - Ваш сын матом ругается. Мама заставляет Вовочку извиниться. - Прости, мужик, х...ня получилась.
Вовочка;Бобик забрался на Жучку... Вовочка спрашивает у мамы: - Что это они делают? - Да, это Жучка Бобика катает... - (удрученно) Вот так всегда - кто везет, того %бут...
Вовочка;Учительница спрашивает: - Что такое плеоназм? (плеоназм - оборот речи, содержащий однозначные, часто излишние слова). Вовочка: - Это когда, например, папа с мамой занимаются любовью в спальне, а в это время по телевизору идет пикантный фильмец. В результате не знаешь, куда лучше смотреть.
Вовочка;Вовочка получил двойку. Отец подносит свой кулак ему под нос и говорит: - Чуешь, чем пахнет? - Опять у матери в .... ковырялся.
Вовочка;- Ты где научился так ругаться, Вова? - Этому нельзя научиться, это дар природы!
Вовочка;Из разговора мальчишек: - У меня нос отца, глаза матери, - заявляет один. - А у меня лоб дедушки, уши дяди, - сказал другой. - А у меня штаны брата, - похвастался Вовочка.
Вовочка;- Вовочка, что получится, если к четырем прибавить один? - Не зна-а-аю, Мария Ивановна. Ставьте двойку. - Ну вот посмотри. Берем четыре пальца, прибавляем еще один. Что получается? - А, понял! Получится фига!
Вовочка;Учительница спрашивает: - Вова, если в одном кармане брюк у тебя десять рублей, а в другом тридцать, что это значит? - Это значит, что я надел чужие брюки.
Вовочка;"Вовочка: - Как правильно пишется, Марьиванна: ""ананизм"" или ""ононизм""? Учительница: - Вова, откуда ты такие слова знаешь? - А че тут знать-то? У нас весь класс этим занимается. - И ты тоже?! - Я - не-е-е. У меня в 1-б баба есть."
Вовочка;Вовочка прибегает домой из школы. - Ой, че было, че было! Училка по труду шла по коридору, несла банку клея, споткнулась, клей разлила, поскользнулась, упала на клей и приклеилась к полу! - Ну, вы ее от пола-то отодрали? - Отодрали, отодрали! Кто посмелее - аж два раза!
Вовочка;Мать Вовочки - учителю: - Мой Вовочка - гений. У него столько гениальных идей, не правда ли? - Да, особенно когда дело доходит до уроков химии.
Вовочка;"Учитель: - Вовочка, назови повелительное наклонение глагола ""молчать"". - Ша!"
Вовочка;"- Дети, что значит: ""Я люблю, ты любишь, он любит?"" - спрашивает учительница. - Я думаю, - отвечает Вовочка, - что это такая ситуация, при которой один наверняка будет убит."
Вовочка;Соседка прибегает к отцу Вовочки. - Вы знаете, ваш сын в кустах козу пялит!!! - Как? Сегодня же четверг, моя очередь!
Вовочка;- Вовочка, открой скорее ротик и скажи а-а-а, чтобы этот злой и противный доктор смог наконец вытащить свой пальчик из твоих зубок!
Вовочка;Вовочка: - Говорят, что учиться зарабатывать надо с детских лет. Это про меня! Я делаю деньги с трех лет - тогда отец стал высылать на меня алименты.
Вовочка;"Учитель спрашивает маленького Вовочка: - Твой пиджак и чего сделан? - Из сукна. - Верно; а сукно из чего выделывается? - Из шерсти! - Молодец! А шерсть кто нам дает? - Овцы. - Умница! Значит, какое животное дало тебе пиджак? - Папа."
Вовочка;Мать: - И это мой родной сын?! Такой капризный и несносный мальчик! Вовочка: - Ты сама, мама, несносная! Да если бы я знал, что у тебя такой характер, то никогда бы не позволил папе жениться на тебе.
Вовочка;Вовочка - отцу: - Я вчера на улице нашел 200 рублей и отнес их в милицию. А что бы ты сделал на моем месте? - То же, что и ты. Соврал.
Вовочка;В школе идут занятия, и учительница объясняет разницу между ветром, зефиром, бризом, торнадо, пассатом, сирокко. Приводит пример: - Недавно я ехала в поезде, и когда портьера на окне слегка отклонилась, я почувствовала нежное, ласкательное прикосновение к щеке. Что это было? Вовочка поднял руку: - Поцелуй контролера, мадмуазель!
Вовочка;Вовочка приходит из школы с испуганным видом и говорит: - Мама, папа, я думаю, сегодня вам не стоит смотреть мой дневник. Мама хватается за сердце, пап за ремень, открывают дневник, а там - пятерка! Все в обмороке. Вовочка (грустно): - Вот этого-то я и боялся.
Вовочка;Учитель предупреждает учеников: - Никогда нельзя целовать животных. Это грозит различными заболеваниями. Кто может привести пример? - Я, - встал Вовочка, - вот моя тетя все время целовала своего попугая. - Ну и?.. - Попугай с ума сошел.
Вовочка;Проходят в школе на уроке пения композиторов. Вызвала учительница Вовочку. - Каких ты знаешь композиторов? А Вовочка не учил. Стоит и смотрит на товарища. Тот взял книгу, стукнул по парте. - Бах, - сказал Вовочка. - Правильно, - сказала учительница. Друг вырвал из тетради листок. - Лист, - сказал Вовочка. - Хорошо, еще, - просит учительница. - Членников, - говорит Вовочка. А учительница ему: - Не Членников, а Хренников, а ты, Петров, убери подсказку.
Вовочка;"Вовочка в ""Живом уголке"" вертит в руках курицу. Она орет, вырывается, кричит благим матом так, что крик слышен на всю школу7. Влетает в ""уголок"" ботаничка и в испуге спрашивает: - Что ты делаешь? - Как что, - спокойно отвечает Вовочка, - я ищу у нее эрогенные зоны."
Вовочка;Маме, приехавшей с курорта, Вовочка рассказывает, как весело они с папой жили целый месяц: - К нам каждый вечер приходила тетя Люда. Приносила мне конфеты, а папа угощал ее вином, а потом они делали то же, что и вы с дядей Колей, когда папа уезжал в командировку.
Вовочка;- Кого ты больше любишь, Вовочка, маму или папу? - папу. - Почему? - Его никогда нет дома.
Вовочка;- Вовочка, почему у тебя грязные руки? - спросила мама. - Потому что я ими только что мыл лицо.
Вовочка;Вовочка: - Папа, в школе сегодня родительское собрание, но только для самого узкого круга. - Для самого узкого круга? Как это понять? - Будут только учитель и ты.
Вовочка;- Скажи, Вовочка, какой предмет тебе больше всего нравится в школе? - Звонок, папа.
Вовочка;Учительница велела ученикам принести в школу медицинские инструменты, кто что может: ножницы, пинцет, шприц... Вовочка принес дыхательный аппарат. Учительница спрашивает: - Вовочка, где ты его взял? - У дедушки, - отвечает Вовочка. - А что он тебе сказал? - Ап-ап-ап...
Вовочка;Вовочка надевает резиновые сапоги. Мама ему говорит: - Вовочка, на улице сухо, грязи и луж нет. - А я найду, - весело отвечает он.
Вовочка;- Вовочка, не качайся на папе: не для того он повесился!
Вовочка;"Учительница спрашивает школьников: - Кто назовет женское имя с тремя буквами ""В""? Вовочка тянет руку: - Широкая задница! - Откуда ты взял?! Здесь же нет ни одной буквы ""В""! - Мы с папой вчера гуляли по улице и встретили вот такую широкую тетю. Папа оглянулся и все время говорил: ""Вай-вай-вай! Вай-вай-вай!"""
Вовочка;"Учительница спрашивает в классе: - Чем отличается жизнь до революции от той, что сейчас? Вовочка: - До революции говорили: ""Пшел вон!"" А теперь говорят: ""Приходите завтра!"""
Вовочка;Учитель: - Женщина смотрит из окна, какое это число? - Единственное, - отвечает Маша. - А что мы скажем, если три женщины смотрят из окна? - Это бордель, - ответил Вовочка.
Вовочка;"Учитель задал сочинение на тему: ""Если бы я был директором фирмы..."" Все старательно пишут, и только Вовочка смотрит в окно. - А ты почему не пишешь? - Ожидаю секретаршу!"
